id,status,evidence
TCI-QA-014,Partial,"Two banned-phrasing patterns exist and are enforced: the missions schema+copy sweep (tests/missions.test.ts:73-78,159-173 — no xp/streak/league/points/badge/level-up) and the LMS/curriculum sweep (tests/capability-curriculum.test.ts:55-110). The TCI Benchmarks screen (§6.10) and 'ready for next level' framing are gamification-risk copy with no sweep yet."
TCI-QA-015,Partial,"The parity patterns exist: digest↔dashboard share the SAME coaching source with identical selection+order (tests/digest-content.test.ts:261-268), and migration-equivalence/output-equivalence guards pin byte-identical behavior (tests/recommendation-catalog.test.ts:225-255, tests/utility-ranker.test.ts). TCI adds weekly/monthly/quarterly reports + manager notifications that must not drift from the on-screen numbers — no such parity test exists yet."
TCI-QA-016,Partial,"Known flakes are documented (CLAUDE.md: occasional '[vitest-pool]: Worker exited unexpectedly' Windows fork crash, a rare pseudonym-collision in tests/api-impl.test.ts, and 2-5 auth/connector files failing a different set under load — confirm by running named files in isolation). A perf guard already pins read cost independent of person count (tests/perf/capability-state-queries.test.ts:46-62, 20x people → identical query count). New team aggregates must add the same perf guard, and CI must keep the rerun-on-flake strategy."
TCI-DOC-001,Conflicting,"tci.md:5 declares 'Document version: 1.0' with no provenance/author/repo-path; every requirement line is tagged [INFERRED, HIGH|MED] (e.g. tci.md:9, tci.md:33, tci.md:2289) — 100% inferred, zero signed. Repo rule that this collides with: CLAUDE.md 'Ground truth: Product Spec V4'; docs/product-signoffs.md:1-9 (founder judges evidence; human gates never self-certified, rule 4)."
TCI-DOC-002,Partial,"House style exists and is proven: docs/legacy/product/revealyst-gap-analysis.md:1-11 (narrative + 'Companion artifacts' list), docs/product/requirements.csv (header id,spec_section,tier,domain,requirement), docs/legacy/product/traceability.csv (id,spec_section,tier,domain,status,evidence), docs/legacy/product/implementation-roadmap.md. The TCI-specific instance of these does not yet exist."
TCI-DOC-003,Partial,Pattern exists: docs/legacy/ai-capability-implementation-gap-analysis.md:1-16 (a '> Superseded.' banner pointing to CLAUDE.md wave banners as current truth); docs/Revealyst_Execution_Plan_V4.md §7 'Documentation state & the single-source-of-truth rule'. No TCI doc carries it yet.
TCI-DOC-004,Missing,Governance rules: docs/decisions/README.md:1-15 (ADR required before a frozen-contract change; unique 4-digit prefixes CI-enforced; ADR vs migration numbers independent); CLAUDE.md 'A new org-scoped table needs THREE registrations' (tenant-isolation SCOPED_READS + ADR + account-deletion purge). TCI proposes ~8 new entities (tci.md:1843-1935) with zero ADRs drafted.
TCI-DOC-005,Missing,"Ledger exists and is the required home: docs/product-signoffs.md:1-9 + the D4/D5/D7/D8/D9/D10/OQ-00x rows. No TCI rows exist. CLAUDE.md rule 4: gates are human-reviewed, never self-certified by the authoring agent."
TCI-DOC-006,Conflicting,"TCI wants it: tci.md:651-711 (Capability Matrix rows = named team members with per-capability cells) and tci.md:845-995 (manager-facing individual profile with capability breakdown). Founder-signed opposite: mastery is deliberately self-view-only — docs/decisions/0036-user-capability-state.md; CLAUDE.md P2 'org-scoped, self-view-only mastery table' and P7 'self-view-only — no manager/admin read route; never on the team view'."
TCI-DOC-007,Conflicting,"TCI: tci.md:771-843 (Team Members table, per-member rows) and tci.md:651-769 (matrix, optional grouped rows by squad/location). Founder-signed opposite: team view is count-only with a MIN_PEOPLE champion floor and pseudonymized private mode — CLAUDE.md W5 'segments count-only-everywhere + MIN_PEOPLE champion floor'; P6 'count-only, MIN_PEOPLE-floored ... a capability below the floor is dropped entirely (never a suppressed-but-implied number)'; src/lib/nav-items.ts + team-overview is 5 count-only card sections."
TCI-DOC-008,Conflicting,"TCI: tci.md:99-119 (managers see 'individual-level cost analytics'), tci.md:963-981 (per-member Cost and Usage tab), tci.md:1309-1329 (Individual Cost Table with per-member monthly spend). It does add an admin toggle (tci.md:1997) and 'never reduce access solely because expensive' (tci.md:1361). Tension with: the count-only/pseudonymized team model (CLAUDE.md W5) and spend surfaced today at team grain (src/lib/nav-items.ts:88 '/spend')."
TCI-DOC-009,Conflicting,"TCI: tci.md:63 'Sensitive prompt content should not be exposed by default', tci.md:1601 'whether prompt-level evidence is available', tci.md:1981 'behavioral summaries, not raw private conversations by default'. The 'by default' framing implies it can be enabled. Hard ban: CLAUDE.md Tripwires 'no prompt-content ingestion in Team mode'; docs/Revealyst_Product_Spec_V4 NOT-list; the founder-signed desktop-collector direction is content-free events only."
TCI-DOC-010,Blocked,TCI: tci.md:291-409 (seven non-eng packs) — though §14 (tci.md:2167) sensibly recommends Engineering-first. Named gate: docs/product/requirements.csv:110 NOT-015 'No non-engineering role libraries in MVP or V1'; docs/Revealyst_Execution_Plan_V4.md Future ledger 'Role expansion beyond Engineering — Evidence-gated: the §16(3) research question (M365 Copilot / Google Workspace admin APIs as honest telemetry) answered affirmatively'; OQ-003 (requirements.csv:155) + OQ-004 (:156).
TCI-DOC-011,Blocked,"TCI: tci.md:9 'extends the existing Individual AI Growth Companion into a manager-facing capability development platform'; entire §13 MVP (tci.md:2101-2133). Named gate: CLAUDE.md 'W6-A (Companion-in-Team-orgs + dual-source dedup) on the §14 ~6-week dogfood outcome'; docs/legacy/product/revealyst-gap-analysis.md:22 (the #1 structural gap is deliberately gated, clock since 2026-07-14)."
TCI-DOC-012,Conflicting,"TCI: tci.md:447-475. Founder-signed opposite: the shipped team nav is four primary items — src/lib/nav-items.ts:72-75 (Team, AI maturity, Connections, Account) + a small admin group (:86-88); CLAUDE.md W5 'Team Intelligence folded ~18 panels → 5 cards'; product-signoffs D4 'fewer/larger cards, progressive disclosure, one dominant action per screen'; CLAUDE.md UX principle 'minimal by default'."
TCI-DOC-013,Conflicting,"TCI: tci.md:415-445 (CapabilityScore.score:number, level enum) and tci.md:503-531 (large score as the primary card). Founder-signed opposite: the raw 0–100 is deliberately demoted behind a diagnostic expander and the maturity ladder is a separate 0–4 MODELED model — CLAUDE.md W5 'raw 0–100 demoted behind a diagnostic-details expander ... never a 4th ladder'; src/lib/maturity-glossary.ts:34-53 (levels 0–4, distinct copy); product-signoffs OQ-008 'capability profile = breakdown of the existing band, NOT a new/third scoring system'."
TCI-DOC-014,Conflicting,"TCI: tci.md:2289 'positioned as an AI Capability Intelligence and Growth Platform', tci.md:5 'Primary users: Team managers ...'. Founder-signed opposite: docs/product/requirements.csv:VIS-001 'individual-first Personal AI Companion; team/exec intelligence is a by-product surface, never the individual pitch'; CLAUDE.md 'bottom-up Personal AI Companion whose individual signal compounds into ... intelligence CTOs pay for'; onboarding is companion-pitch-first."
TCI-DOC-015,Missing,The rule is stated only in this task's orchestration prompt; it has no repo home. It must sit beside the analysis (docs/product/tci/ narrative + a note in docs/product-signoffs.md) so future readers apply it consistently. Precedent: docs/product-signoffs.md 'Notes' section already documents how default/pending/ratified rows behave.
